{
  "schema_version": 1,
  "status": "completed",
  "extracted_at": "2026-10-01T12:00:00Z",
  "pipeline": {
    "text_engine": "unpdf",
    "llm_provider": "gemini",
    "llm_model": "gemini-2.0-flash",
    "used_fallback": false
  },
  "document": {
    "page_count": 3,
    "text_char_count": 4200,
    "ocr_page_indexes": [],
    "warnings": []
  },
  "visits": [
    {
      "weekday": 2,
      "start_time": "08:00",
      "end_time": "10:00",
      "timezone": "America/New_York",
      "starts_on": "2026-10-01",
      "ends_on": null,
      "confidence": 0.92
    }
  ],
  "requirements": [
    {
      "key": "req_1",
      "task": "Sweep lobby",
      "requires_photo": true,
      "is_mandatory": true,
      "zone_code": null,
      "confidence": 0.9,
      "evidence_quote": "Lobby shall be swept weekly"
    },
    {
      "key": "req_2",
      "task": "Empty trash receptacles",
      "requires_photo": true,
      "is_mandatory": true,
      "zone_code": null,
      "confidence": 0.88,
      "evidence_quote": "All trash removed each service"
    }
  ]
}
