{
  "schema_version": 1,
  "status": "completed",
  "extracted_at": "2026-10-01T12:00:00Z",
  "pipeline": {
    "text_engine": "unpdf",
    "llm_provider": "gemini",
    "llm_model": "gemini-2.0-flash",
    "used_fallback": false
  },
  "document": {
    "page_count": 2,
    "text_char_count": 1800,
    "ocr_page_indexes": [],
    "warnings": [
      "Contract requires photo evidence for trash removal; model did not flag requires_photo."
    ]
  },
  "visits": [
    {
      "weekday": 3,
      "start_time": "18:00",
      "end_time": "20:00",
      "timezone": "America/New_York",
      "starts_on": "2026-10-01",
      "ends_on": null,
      "confidence": 0.75
    }
  ],
  "requirements": [
    {
      "key": "req_trash",
      "task": "Remove trash from kitchen",
      "requires_photo": false,
      "is_mandatory": true,
      "zone_code": null,
      "confidence": 0.7,
      "evidence_quote": "Trash shall be removed nightly"
    }
  ]
}
